{"actualInputSupportDecisionIncluded":false,"artifactCount":14,"artifacts":[{"artifactId":"bundle-readme","licenseSpdx":"MIT","mediaType":"text/markdown; charset=utf-8","path":"README.md","provenance":{"dependsOnArtifactIds":[],"derivation":"authored","sourceReferenceId":"oridesign-neg-support-catalog-candidates-v1","sourceUse":"project-authored"},"role":"readme","sha256":"sha256:7758abb28a23590a06107a7a0937f785e5e1b32430415cc7c9b82aedd2150974"},{"artifactId":"control-support-profile-candidate-catalog","licenseSpdx":"MIT","mediaType":"application/json","path":"control-support-profile-candidate-catalog.json","provenance":{"dependsOnArtifactIds":[],"derivation":"authored","sourceReferenceId":"oridesign-neg-support-catalog-candidates-v1","sourceUse":"project-authored"},"role":"accepted-control","sha256":"sha256:51e2b500a91264a5ebd689d1a8e3286359e7c0678c54d3ccd31ddde716bdb8a4"},{"artifactId":"source-premature-frozen","licenseSpdx":"MIT","mediaType":"application/json","path":"premature-frozen.json","provenance":{"dependsOnArtifactIds":["control-support-profile-candidate-catalog"],"derivation":"mutated-from-control","sourceReferenceId":"oridesign-neg-support-catalog-candidates-v1","sourceUse":"project-authored"},"role":"negative-source","sha256":"sha256:dbd6d2ea8b01448596e460adecf02980a3a639b6494848c301d6c26da3c1e615"},{"artifactId":"source-premature-profile-hash","licenseSpdx":"MIT","mediaType":"application/json","path":"premature-profile-hash.json","provenance":{"dependsOnArtifactIds":["control-support-profile-candidate-catalog"],"derivation":"mutated-from-control","sourceReferenceId":"oridesign-neg-support-catalog-candidates-v1","sourceUse":"project-authored"},"role":"negative-source","sha256":"sha256:cdb4c16d30f3892714362caf6d45d48e89adff25b9c1c95b81cc5e210a4c5446"},{"artifactId":"source-select-tree-max-degree","licenseSpdx":"MIT","mediaType":"application/json","path":"select-tree-max-degree.json","provenance":{"dependsOnArtifactIds":["control-support-profile-candidate-catalog"],"derivation":"mutated-from-control","sourceReferenceId":"oridesign-neg-support-catalog-candidates-v1","sourceUse":"project-authored"},"role":"negative-source","sha256":"sha256:916c69c07eca1c8d76881183953268d7c2c54d2d553568890346a32a4e3dd9d0"},{"artifactId":"source-select-tree-decimal-digits","licenseSpdx":"MIT","mediaType":"application/json","path":"select-tree-decimal-digits.json","provenance":{"dependsOnArtifactIds":["control-support-profile-candidate-catalog"],"derivation":"mutated-from-control","sourceReferenceId":"oridesign-neg-support-catalog-candidates-v1","sourceUse":"project-authored"},"role":"negative-source","sha256":"sha256:142afd0309deb91eae031a033282edfc79529fa51ca07c19be3cf2495fca5a72"},{"artifactId":"source-select-tree-length-ratio","licenseSpdx":"MIT","mediaType":"application/json","path":"select-tree-length-ratio.json","provenance":{"dependsOnArtifactIds":["control-support-profile-candidate-catalog"],"derivation":"mutated-from-control","sourceReferenceId":"oridesign-neg-support-catalog-candidates-v1","sourceUse":"project-authored"},"role":"negative-source","sha256":"sha256:762703e8a30bb47b3ceb8e1e7db9dede7f9eeefd29450aa757fe5816a9d51d95"},{"artifactId":"source-select-grid-columns","licenseSpdx":"MIT","mediaType":"application/json","path":"select-grid-columns.json","provenance":{"dependsOnArtifactIds":["control-support-profile-candidate-catalog"],"derivation":"mutated-from-control","sourceReferenceId":"oridesign-neg-support-catalog-candidates-v1","sourceUse":"project-authored"},"role":"negative-source","sha256":"sha256:82c0156f4b193b9946daf5be560f2beb7293968386d8700247d3dfc766501dcd"},{"artifactId":"source-select-grid-quantization-error","licenseSpdx":"MIT","mediaType":"application/json","path":"select-grid-quantization-error.json","provenance":{"dependsOnArtifactIds":["control-support-profile-candidate-catalog"],"derivation":"mutated-from-control","sourceReferenceId":"oridesign-neg-support-catalog-candidates-v1","sourceUse":"project-authored"},"role":"negative-source","sha256":"sha256:581a13428b069377ec01f002582e711c22b212c610c9e22db1dfbadcb93b8b8b"},{"artifactId":"source-select-fold-max-vertices","licenseSpdx":"MIT","mediaType":"application/json","path":"select-fold-max-vertices.json","provenance":{"dependsOnArtifactIds":["control-support-profile-candidate-catalog"],"derivation":"mutated-from-control","sourceReferenceId":"oridesign-neg-support-catalog-candidates-v1","sourceUse":"project-authored"},"role":"negative-source","sha256":"sha256:85708f9df4bfb711dca61808674780dc7725db0924212fb19057d16fa3df1e76"},{"artifactId":"source-premature-evidence","licenseSpdx":"MIT","mediaType":"application/json","path":"premature-evidence.json","provenance":{"dependsOnArtifactIds":["control-support-profile-candidate-catalog"],"derivation":"mutated-from-control","sourceReferenceId":"oridesign-neg-support-catalog-candidates-v1","sourceUse":"project-authored"},"role":"negative-source","sha256":"sha256:99b9f75288450a3a2e8061d73ce5345cf9e6941bf88991906bd3df686262ba52"},{"artifactId":"source-method-mismatch","licenseSpdx":"MIT","mediaType":"application/json","path":"method-mismatch.json","provenance":{"dependsOnArtifactIds":["control-support-profile-candidate-catalog"],"derivation":"mutated-from-control","sourceReferenceId":"oridesign-neg-support-catalog-candidates-v1","sourceUse":"project-authored"},"role":"negative-source","sha256":"sha256:59b6fa77cc192c8bfdd071a783220453ae15c72f37fa629ee14510f65adcfcba"},{"artifactId":"source-unknown-solver-key","licenseSpdx":"MIT","mediaType":"application/json","path":"unknown-solver-key.json","provenance":{"dependsOnArtifactIds":["control-support-profile-candidate-catalog"],"derivation":"mutated-from-control","sourceReferenceId":"oridesign-neg-support-catalog-candidates-v1","sourceUse":"project-authored"},"role":"negative-source","sha256":"sha256:767c0a7d99c3c60cb19c73771b2af4e8f5fa0dfd588de995edcf8b817c666950"},{"artifactId":"source-unsorted-candidates","licenseSpdx":"MIT","mediaType":"application/json","path":"unsorted-candidates.json","provenance":{"dependsOnArtifactIds":["control-support-profile-candidate-catalog"],"derivation":"mutated-from-control","sourceReferenceId":"oridesign-neg-support-catalog-candidates-v1","sourceUse":"project-authored"},"role":"negative-source","sha256":"sha256:954e9cae2e122a51c1d759edb4ddeeebe8da9dc0b9a520a0311218fa93f9a3ac"}],"candidateCatalogOnly":true,"canonicalManifestPath":"tests/fixtures/manifest.json","canonicalManifestRegistration":"not-registered","canonicalPromotionClaimed":false,"canonicalSupportBoundaryFamilyClaimed":false,"caseCount":12,"cases":[{"caseId":"NEG-SUPPORT-CATALOG-PREMATURE-FROZEN","caseIndex":0,"changedPaths":["$.status"],"controlArtifactId":"control-support-profile-candidate-catalog","expectedIssues":[{"code":"premature-frozen-profile","path":"$.status"}],"expectedOutcome":"rejected","mutationKind":"replace-candidate-status-with-frozen","sourceArtifactId":"source-premature-frozen","sourcePath":"premature-frozen.json"},{"caseId":"NEG-SUPPORT-CATALOG-PREMATURE-PROFILE-HASH","caseIndex":1,"changedPaths":["$.profiles[0].profileHash"],"controlArtifactId":"control-support-profile-candidate-catalog","expectedIssues":[{"code":"premature-profile-hash","path":"$.profiles[0].profileHash"}],"expectedOutcome":"rejected","mutationKind":"attach-profile-hash-before-evidence","sourceArtifactId":"source-premature-profile-hash","sourcePath":"premature-profile-hash.json"},{"caseId":"NEG-SUPPORT-CATALOG-SELECT-TREE-MAX-DEGREE","caseIndex":2,"changedPaths":["$.profiles[0].constraints.maxTreeDegree.selected"],"controlArtifactId":"control-support-profile-candidate-catalog","expectedIssues":[{"code":"premature-selection","path":"$.profiles[0].constraints.maxTreeDegree.selected"}],"expectedOutcome":"rejected","mutationKind":"select-tree-max-degree-candidate","sourceArtifactId":"source-select-tree-max-degree","sourcePath":"select-tree-max-degree.json"},{"caseId":"NEG-SUPPORT-CATALOG-SELECT-TREE-DECIMAL-DIGITS","caseIndex":3,"changedPaths":["$.profiles[0].constraints.maxInputDecimalDigits.selected"],"controlArtifactId":"control-support-profile-candidate-catalog","expectedIssues":[{"code":"premature-selection","path":"$.profiles[0].constraints.maxInputDecimalDigits.selected"}],"expectedOutcome":"rejected","mutationKind":"select-tree-decimal-digit-candidate","sourceArtifactId":"source-select-tree-decimal-digits","sourcePath":"select-tree-decimal-digits.json"},{"caseId":"NEG-SUPPORT-CATALOG-SELECT-TREE-LENGTH-RATIO","caseIndex":4,"changedPaths":["$.profiles[0].constraints.maxNormalizedLengthRatio.selected"],"controlArtifactId":"control-support-profile-candidate-catalog","expectedIssues":[{"code":"premature-selection","path":"$.profiles[0].constraints.maxNormalizedLengthRatio.selected"}],"expectedOutcome":"rejected","mutationKind":"select-tree-length-ratio-candidate","sourceArtifactId":"source-select-tree-length-ratio","sourcePath":"select-tree-length-ratio.json"},{"caseId":"NEG-SUPPORT-CATALOG-SELECT-GRID-COLUMNS","caseIndex":5,"changedPaths":["$.profiles[1].constraints.maxGridColumns.selected"],"controlArtifactId":"control-support-profile-candidate-catalog","expectedIssues":[{"code":"premature-selection","path":"$.profiles[1].constraints.maxGridColumns.selected"}],"expectedOutcome":"rejected","mutationKind":"select-box-grid-column-candidate","sourceArtifactId":"source-select-grid-columns","sourcePath":"select-grid-columns.json"},{"caseId":"NEG-SUPPORT-CATALOG-SELECT-GRID-QUANTIZATION-ERROR","caseIndex":6,"changedPaths":["$.profiles[1].constraints.maxNormalizedQuantizationError.selected"],"controlArtifactId":"control-support-profile-candidate-catalog","expectedIssues":[{"code":"premature-selection","path":"$.profiles[1].constraints.maxNormalizedQuantizationError.selected"}],"expectedOutcome":"rejected","mutationKind":"select-box-grid-quantization-error-candidate","sourceArtifactId":"source-select-grid-quantization-error","sourcePath":"select-grid-quantization-error.json"},{"